{
  "score": 5,
  "target_score": 5,
  "fail_under": 3,
  "reviewed_sha": "abc123",
  "status": "passed",
  "verdict": "Good structure, but not ready for merge because one test gap remains.",
  "models": ["deepseek/deepseek-v4-flash", "tests"],
  "estimated_cost_usd": 0.08,
  "cost_summary": {
    "current_run_usd": 0.08,
    "components": [
      {
        "label": "general",
        "model": "deepseek/deepseek-v4-flash",
        "prompt_tokens": 12400,
        "completion_tokens": 900,
        "estimated_cost_usd": 0.06
      },
      {
        "label": "tests",
        "model": "qwen/qwen3-coder",
        "prompt_tokens": 4100,
        "completion_tokens": 500,
        "estimated_cost_usd": 0.02
      }
    ]
  },
  "findings": [
    {
      "id": "rg_001",
      "severity": "P2",
      "confidence": 0.86,
      "file": "app/webhooks/retry.py",
      "line": 42,
      "title": "Missing regression test for retry exhaustion",
      "detail": "The new retry path has behavior changes but no focused regression coverage.",
      "agent_instruction": "Add a regression test for webhook retry exhaustion before merge."
    },
    {
      "id": "rg_002",
      "severity": "P4",
      "confidence": 0.72,
      "file": "app/webhooks/retry.py",
      "line": 17,
      "title": "Helper name is slightly vague",
      "detail": "The helper name hides that it only handles terminal retry states.",
      "agent_instruction": "Consider renaming the helper if touching this file again."
    }
  ],
  "notes": ["Fixture intentionally starts with score 5 so the CLI can prove deterministic recomputation."]
}
